query,intent,priority
best newborn photographer baltimore,bofu,high
baltimore cake smash photographer,bofu,high
maternity photographer baltimore md,bofu,high
headshot photographer baltimore,bofu,high
family photographer baltimore,bofu,high
best baby photographer near me baltimore,bofu,high
newborn photographer towson md,bofu,medium
photographer for first birthday baltimore,bofu,medium
personal branding photographer baltimore,bofu,medium
mini session photographer baltimore,bofu,medium
when to schedule newborn photos,informational,medium
how to choose a newborn photographer,informational,medium
what to wear for family photos,informational,medium
newborn photography studio vs at home,comparison,medium
best maternity photographers in maryland,solution-aware,medium
affordable family photographer baltimore area,problem-aware,medium
baltimore photographer for corporate headshots,bofu,medium
sitter session photographer baltimore,bofu,low
sports photographer baltimore youth,bofu,low
milk bath baby photographer baltimore,bofu,low
